UID,Symbol,Name,Half-lives in LB,Half-lives in M9
B1856,yebA,"yebA orf, hypothetical protein ",3.6,1.5
B1857,yebL,yebL putative adhesin ,,3.1
B1858,yebM,yebM putative ATP-binding component of a transport system ,5.1,3.5
B1859,yebI,"yebI orf, hypothetical protein ",6.5,3.7
B1860,ruvB,ruvB Holliday junction helicase subunit A; branch migration; repair ,4.9,4.6
B1861,ruvA,ruvA Holliday junction helicase subunit B; branch migration; repair ,,5.4
B1862,yebB,"yebB orf, hypothetical protein ",3.4,9
B1863,ruvC,ruvC Holliday junction nuclease; resolution of structures; repair ,4.2,4
B1864,yebC,"yebC orf, hypothetical protein ",2.9,3.5
B1865,ntpA,ntpA dATP pyrophosphohydrolase ,2.5,4.9
B1866,aspS,aspS aspartate tRNA synthetase ,,3.2
B1867,yecD,"yecD orf, hypothetical protein ",4.2,5.1
B1868,yecE,"yecE orf, hypothetical protein ",,4.7
B1869,yecN,"yecN orf, hypothetical protein ",3.3,6.1
B1870,yecO,"yecO orf, hypothetical protein ",3.8,3.2
B1871,yecP,yecP putative enzyme ,3.6,6.8
B1872,BisZ,BisZ Biotin sulfoxide reductase 2 ,,6.6
B1873,yecK,yecK putative cytochrome C-type protein ,4.9,4
B1874,cutC,cutC copper homeostasis protein ,,5.6
B1875,yecM,"yecM orf, hypothetical protein ",,5
B1876,argS,argS arginine tRNA synthetase ,2.6,3.3
B1877,yecT,"yecT orf, hypothetical protein ",8.9,6.4
B1878,flhE,flhE flagellar protein ,,4.6
B1879,flhA,flhA flagellar biosynthesis; possible export of flagellar proteins ,4.8,11.7
B1880,flhB,flhB putative part of export apparatus for flagellar proteins ,6.3,7
B1881,cheZ,cheZ chemotactic response; CheY protein phophatase; antagonist of CheY as switch regulator ,5.7,7
B1882,cheY,cheY chemotaxis regulator transmits chemoreceptor signals to flagelllar motor components ,,4.9
B1883,cheB,cheB response regulator for chemotaxis (cheA sensor); protein methylesterase ,,7.2
B1884,cheR,cheR response regulator for chemotaxis; protein glutamate methyltransferase ,5.3,5.7
B1885,tap,"tap methyl-accepting chemotaxis protein IV, peptide sensor receptor ",6.4,10.5
B1886,tar,"tar methyl-accepting chemotaxis protein II, aspartate sensor receptor ",,
B1887,cheW,cheW positive regulator of CheA protein activity ,6.4,
B1888,cheA,cheA sensory transducer kinase between chemo- signal receptors and CheB and CheY ,,10.4
B1889,motB,"motB enables flagellar motor rotation, linking torque machinery to cell wall ",,7.4
B1890,motA,motA proton conductor component of motor; no effect on switching ,4.9,4.3
B1891,flhC,flhC regulator of flagellar biosynthesis acting on class 2 operons; transcription initiation factor ,,5.1
B1892,flhD,"flhD regulator of flagellar biosynthesis, acting on class 2 operons; transcriptional initiation factor ",6.7,6.7
B1893,insB_5,insB_5 IS1 protein InsB ,4.1,
B1894,insA_5,insA_5 IS1 protein InsA ,13.1,7.5
B1895,yecG,yecG putative regulator ,5.1,4.3
B1896,otsA,otsA trehalose-6-phosphate synthase ,3.9,2.1
B1897,otsB,"otsB trehalose-6-phosphate phophatase, biosynthetic ",4.6,2
B1898,araH_2,"araH_2 high-affinity L-arabinose transport system; membrane protein, fragment 2 ",5,6.9
B1899,araH_1,"araH_1 high-affinity L-arabinose transport system; membrane protein, fragment 1 ",,5.2
B1900,araG,araG ATP-binding component of high-affinity L-arabinose transport system ,11.2,4.5
B1901,araF,araF L-arabinose-binding periplasmic protein ,6.8,5.8
B1902,yecI,yecI ferritin-like protein ,4.5,5.5
B1903,B1903,"B1903 orf, hypothetical protein ",10.9,3.3
B1904,B1904,"B1904 orf, hypothetical protein ",5.4,6
B1905,ftn,ftn cytoplasmic ferritin (an iron storage protein) ,5.3,4.3
B1906,yecH,"yecH orf, hypothetical protein ",5.9,6.5
B1907,tyrP,tyrP tyrosine-specific transport system ,,5.5
B1908,yecA,"yecA orf, hypothetical protein ",5.2,2.6
B1912,pgsA,"pgsA phosphatidylglycerophosphate synthetase = CDP-1,2-diacyl-sn-glycero-3-phosphate phosphatidyl transferase ",,5.2
B1913,uvrC,"uvrC excinuclease ABC, subunit C; repair of UV damage to DNA ",2,2.7
B1914,uvrY,uvrY putative 2-component transcriptional regulator ,3.6,2.9
B1915,yecF,"yecF orf, hypothetical protein ",4.9,5
B1916,sdiA,sdiA transcriptional regulator of ftsQAZ gene cluster ,9.7,4.4
B1917,yecC,yecC putative ATP-binding component of a transport system ,4.4,4.9
B1918,yecS,yecS putative transport system permease protein (former yecC) ,,4.6
B1919,yedO,yedO putative 1-aminocyclopropane-1-carboxylate deaminase ,,5.6
B1920,fliY,fliY putative periplasmic binding transport protein ,5.5,4.8
B1921,fliZ,"fliZ orf, hypothetical protein ",4.1,6.1
B1922,fliA,fliA flagellar biosynthesis; alternative sigma factor 28; regulation of flagellar operons ,6.7,5.3
B1923,fliC,"fliC flagellar biosynthesis; flagellin, filament structural protein ",,8.1
B1924,fliD,fliD flagellar biosynthesis; filament capping protein; enables filament assembly ,4.9,8.3
B1925,fliS,fliS flagellar biosynthesis; repressor of class 3a and 3b operons (RflA activity) ,4.2,5.7
B1926,fliT,fliT flagellar biosynthesis; repressor of class 3a and 3b operons (RflA activity) ,,6.5
B1927,amyA,amyA cytoplasmic alpha-amylase ,8.9,6.7
B1928,yedD,"yedD orf, hypothetical protein ",6.3,4.1
B1929,yedE,yedE putative transport system permease protein ,2.9,8.2
B1930,yedF,"yedF orf, hypothetical protein ",10.5,4.8
B1931,yedK,"yedK orf, hypothetical protein ",7.6,5
B1932,yedL,"yedL orf, hypothetical protein ",9.3,4.6
B1933,B1933,"B1933 orf, hypothetical protein ",6.6,6.3
B1934,yedN,"yedN orf, hypothetical protein ",,4.8
B1935,yedM,"yedM orf, hypothetical protein ",4.1,5.8
B1936,B1936,"B1936 orf, hypothetical protein ",12.1,4.7
B1937,fliE,"fliE flagellar biosynthesis; basal-body component, possibly at (MS-ring)-rod junction ",,8.6
B1938,fliF,fliF flagellar biosynthesis; basal-body MS(membrane and supramembrane)-ring and collar protein ,10.7,20.4
B1939,fliG,"fliG flagellar biosynthesis, component of motor switching and energizing, enabling rotation and determining its direction ",,8.7
B1940,fliH,fliH flagellar biosynthesis; export of flagellar proteins? ,3.6,8.1
B1941,fliI,fliI flagellum-specific ATP synthase ,,6.1
B1942,fliJ,fliJ flagellar fliJ protein ,2.9,5.3
B1943,fliK,fliK flagellar hook-length control protein ,2.4,7.3
B1944,fliL,fliL flagellar biosynthesis ,,8.4
B1945,fliM,"fliM flagellar biosynthesis, component of motor switch and energizing, enabling rotation and determining its direction ",3.2,7
B1946,fliN,"fliN flagellar biosynthesis, component of motor switch and energizing, enabling rotation and determining its direction ",,12.2
B1947,fliO,fliO flagellar biosynthesis ,9.1,8.6
B1948,fliP,fliP flagellar biosynthesis ,4.9,15.3
B1949,fliQ,fliQ flagellar biosynthesis ,6.2,5.9
B1950,fliR,fliR flagellar biosynthesis ,6.3,5.7
B1951,rcsA,"rcsA positive regulator for ctr capsule biosynthesis, positive transcription factor ",6.8,6.7
B1952,dsrB,"dsrB orf, hypothetical protein ",6.5,5.1
B1953,B1953,"B1953 orf, hypothetical protein ",,11
B1955,B1955,"B1955 orf, hypothetical protein ",4.5,4.7
B1956,B1956,"B1956 orf, hypothetical protein ",5.2,3.4
B1957,B1957,"B1957 orf, hypothetical protein ",,9
B1958,yedI,"yedI orf, hypothetical protein ",3.7,3.4
B1959,yedA,yedA putative transmembrane subunit ,5.5,6.9
B1960,vsr,"vsr DNA mismatch endonuclease, patch repair protein ",7.2,7.2
B1961,dcm,dcm DNA cytosine methylase ,4.1,3.4
B1962,yedJ,"yedJ orf, hypothetical protein ",5.8,2.9
B1963,B1963,"B1963 orf, hypothetical protein ",4.6,6.6
B1964,B1964,B1964 putative outer membrane protein ,,5.5
B1965,B1965,"B1965 orf, hypothetical protein ",4.1,6.4
B1966,B1966,B1966 putative outer membrane protein ,,5.8
B1967,yedU,"yedU orf, hypothetical protein ",6.8,7.1
B1968,yedV,yedV putative 2-component sensor protein ,,4.1
B1969,yedW,yedW putative 2-component transcriptional regulator ,5.8,4.7
B1970,B1970,"B1970 orf, hypothetical protein ",8.3,5
B1971,B1971,B1971 putative reductase ,8,4.7
B1972,B1972,"B1972 orf, hypothetical protein ",6.4,5.5
B1973,B1973,"B1973 orf, hypothetical protein ",6.8,
B1974,yodB,yodB putative cytochrome ,3.7,4.7
B1976,B1976,"B1976 orf, hypothetical protein ",8.1,4.1
B1978,B1978,B1978 putative factor ,,6.7
B1979,B1979,"B1979 orf, hypothetical protein ",7.2,4.7
B1980,B1980,"B1980 orf, hypothetical protein ",4.6,13.2
B1981,shiA,"shiA putative transport protein, shikimate ",,4.1
B1982,amn,amn AMP nucleosidase ,,2.5
B1983,B1983,"B1983 orf, hypothetical protein ",4.2,3.4
B1985,yeeO,"yeeO orf, hypothetical protein ",,6.6
B1987,cbl,cbl transcriptional regulator cys regulon; accessory regulatory circuit affecting cysM ,7.8,6.1
B1988,nac,nac nitrogen assimilation control protein ,,4.9
B1990,erfK,"erfK orf, hypothetical protein ",,5.5
B1991,cobT,cobT nicotinate-nucleotide dimethylbenzimidazole-P phophoribosyl transferase ,4.3,3.9
B1992,cobS,cobS cobalamin 5'-phosphate synthase ,,6
B1993,cobU,cobU cobinamide kinase/cobinamide phosphate guanylyltransferase ,5.5,7.6
B1994,trs5_6,trs5_6 IS5 transposase ,,10.6
B1995,B1995,"B1995 orf, hypothetical protein ",10.5,3.8
B1996,yi22_3,yi22_3 IS2 hypothetical protein ,2.9,2
B1997,yi21_3,yi21_3 IS2 hypothetical protein ,,3.4
B1998,B1998,"B1998 orf, hypothetical protein ",5.7,6.4
B1999,yeeP,yeeP putative histone ,4,5
B2000,flu,"flu outer membrane fluffing protein, similar to adhesin ",,13.9
B2001,B2001,"B2001 orf, hypothetical protein ",,9.8
B2002,yeeS,"yeeS putative DNA repair protein, RADC family ",,7
B2004,yeeU,yeeU putative structural protein ,3.9,6.2
B2006,yeeW,"yeeW orf, hypothetical protein ",,5.2
B2007,yeeX,yeeX putative alpha helix protein ,3.2,3.4
B2008,yeeA,"yeeA orf, hypothetical protein ",4.4,4.9
B2009,sbmC,sbmC SbmC protein ,6.9,18.3
B2010,dacD,dacD penicillin binding protein 6b ,2.2,6.8
B2011,sbcB,"sbcB exonuclease I, 3' --> 5' specific; deoxyribophosphodiesterase ",3.6,8.4
B2012,yeeD,"yeeD orf, hypothetical protein ",5.6,3.1
B2013,yeeE,yeeE putative transport system permease protein ,4.4,4.5
B2014,yeeF,yeeF putative amino acid/amine transport protein ,2.1,5.3
B2015,yeeY,yeeY putative transcriptional regulator LYSR-type ,,4
B2016,B2016,B2016 putative enzyme of sugar metabolism ,,2.6
B2017,yefM,"yefM orf, hypothetical protein ",5.6,6.8
B2018,hisL,hisL his operon leader peptide ,5.8,3.9
B2019,hisG,hisG ATP phosphoribosyltransferase ,6.9,2.5
B2020,hisD,hisD L-histidinal:NAD+ oxidoreductase; L-histidinol:NAD+ oxidoreductase ,6.1,3.2
B2021,hisC,hisC histidinol-phosphate aminotransferase ,,3.3
B2022,hisB,hisB imidazoleglycerolphosphate dehydratase and histidinol-phosphate phosphatase ,8.9,4.2
B2023,hisH,hisH glutamine amidotransferase subunit of heterodimer with HisF = imidazole glycerol phosphate synthase holoenzyme ,,
B2024,hisA,hisA N-(5'-phospho-L-ribosyl-formimino)-5-amino-1-(5'- phosphoribosyl)-4-imidazolecarboxamide isomerase ,,
B2025,hisF,hisF imidazole glycerol phosphate synthase subunit in heterodimer with HisH = imidazole glycerol phsphate synthase holoenzyme ,,
B2026,hisI,hisI phosphoribosyl-amp cyclohydrolase; phosphoribosyl-ATP pyrophosphatase ,,
B2027,wzzB,wzzB regulator of length of O-antigen component of lipopolysaccharide chains ,,
B2028,ugd,ugd UDP-glucose 6-dehydrogenase ,,
B2029,gnd,"gnd gluconate-6-phosphate dehydrogenase, decarboxylating ",,
B2030,trs5_7,trs5_7 IS5 transposase ,,10.6
B2031,yefJ,yefJ putative creatinase (EC 3.5.-) ,,
B2032,wbbK,wbbK putative glucose transferase ,,
B2033,wbbJ,wbbJ putative O-acetyl transferase ,,
B2034,wbbI,wbbI putative Galf transferase ,,
B2035,wbbH,wbbH O-antigen polymerase ,,
B2036,glf,glf UDP-galactopyranose mutase ,,
B2037,rfbX,rfbX putative O-antigen transporter ,,2.8
B2038,rfbC,"rfbC dTDP-6-deoxy-D-glucose-3,5 epimerase ",2.6,3.1
B2039,rfbA,rfbA glucose-1-phosphate thymidylyltransferase ,2.9,2.6
B2040,rfbD,rfbD dTDP-6-deoxy-L-mannose-dehydrogenase ,2.8,2.4
B2041,rfbB,"rfbB dTDP-glucose 4,6 dehydratase ",3.1,4.9
B2042,galF,"galF homolog of Salmonella UTP--glucose-1-P uridyltransferase, probably a UDP-gal transferase ",2.2,2.9
B2043,wcaM,"wcaM orf, hypothetical protein ",,16
B2044,wcaL,wcaL putative colanic acid biosynthesis glycosyl transferase ,,7.9
B2045,wcaK,wcaK putative galactokinase (EC 2.7.1.6). ,,
B2046,wzxC,wzxC probable export protein ,,7.7
B2047,wcaJ,wcaJ putative colanic acid biosynthsis UDP-glucose lipid carrier transferase ,4.8,13.2
B2048,cpsG,cpsG phosphomannomutase ,,
B2049,cpsB,cpsB mannose-1-phosphate guanyltransferase ,,10.2
B2050,wcaI,wcaI putative colanic biosynthesis glycosyl transferase ,,5.6
B2051,wcaH,wcaH GDP-mannose mannosyl hydrolase ,,
B2052,wcaG,wcaG putative nucleotide di-P-sugar epimerase or dehydratase ,,13.3
B2053,gmd,gmd GDP-D-mannose dehydratase ,,
B2054,wcaF,wcaF putative transferase ,,7.4
B2055,wcaE,wcaE putative colanic acid biosynthesis glycosyl transferase ,,8.3
B2056,wcaD,wcaD putative colanic acid polymerase ,,4.3
B2057,wcaC,wcaC putative glycosyl transferase ,,6.8
B2058,wcaB,wcaB putative transferase ,9.9,6.9
B2059,wcaA,wcaA putative regulator ,,3.7
B2060,B2060,"B2060 orf, hypothetical protein ",,5.4
B2061,wzb,wzb probable protein-tyrosine-phosphatase ,7.1,
B2062,wza,wza putative polysaccharide export protein ,,4.9
B2063,yegH,yegH putative transport protein ,3.8,
B2064,asmA,asmA suppressor of ompF assembly mutants ,2.2,3.6
B2065,dcd,dcd 2'-deoxycytidine 5'-triphosphate deaminase ,5.9,4.7
B2066,udk,udk uridine/cytidine kinase ,3.6,3.9
B2067,yegE,yegE putative sensor-type protein ,,6
B2068,alkA,"alkA 3-methyl-adenine DNA glycosylase II, inducible ",6.9,8
B2069,yegD,yegD putative heat shock protein ,4.8,6.7
B2070,B2070,B2070 putative chaperonin ,,5.5
B2071,B2071,"B2071 orf, hypothetical protein ",5.4,5.3
B2072,B2072,"B2072 orf, hypothetical protein ",5.8,5.5
B2073,B2073,"B2073 orf, hypothetical protein ",5.9,6.3
B2074,B2074,B2074 putative membrane protein ,,7.7
B2075,yegN,"yegN orf, hypothetical protein ",7,5.3
B2076,yegO,"yegO orf, hypothetical protein ",,6.4
B2077,yegB,yegB putative transport protein ,,13.5
B2078,BaeS,BaeS sensor protein (for BaeR) ,,14.3
B2079,BaeR,BaeR transcriptional response regulatory protein (sensor BaeS) ,10.4,4.9
B2080,B2080,"B2080 orf, hypothetical protein ",,16.9
B2081,yegQ,"yegQ orf, hypothetical protein ",2.5,5
B2082,ogrK,ogrK prophage P2 ogr protein ,,5.8
B2083,B2083,"B2083 orf, hypothetical protein ",,5.1
B2084,B2084,"B2084 orf, hypothetical protein ",6.6,5.7
B2085,B2085,"B2085 orf, hypothetical protein ",,6.5
B2086,B2086,"B2086 orf, hypothetical protein ",,3.8
B2087,gatR_1,"gatR_1 split galactitol utilization operon repressor, interrupted ",,5.1
B2088,B2088,"B2088 orf, hypothetical protein ",,7.8
B2089,tra5_4,tra5_4 IS3 putative transposase ,,4.1
B2090,gatR_2,"gatR_2 split galactitol utilization operon repressor, fragment 2 ",4.1,
B2091,gatD,gatD galactitol-1-phosphate dehydrogenase ,,
B2092,gatC,gatC PTS system galactitol-specific enzyme IIC ,,
B2093,gatB,gatB galactitol-specific enzyme IIB of phosphotransferase system ,,8.6
B2094,gatA,gatA galactitol-specific enzyme IIA of phosphotransferase system ,24.8,5.2
B2095,gatZ,gatZ putative tagatose 6-phosphate kinase 1 ,4.7,3
B2096,gatY,gatY tagatose-bisphosphate aldolase 1 ,2.6,2.2
B2097,B2097,"B2097 orf, hypothetical protein ",,6.2
B2098,yegT,yegT putative nucleoside permease protein ,,6.7
B2099,B2099,"B2099 orf, hypothetical protein ",,6.6
B2100,B2100,B2100 putative kinase ,,8.1
B2101,yegW,yegW putative transcriptional regulator ,4.4,5.6
B2102,yegX,"yegX orf, hypothetical protein ",,6
B2103,thiD,thiD phosphomethylpyrimidine kinase ,5.6,5.4
B2104,thiM,thiM hydoxyethylthiazole kinase ,,
B2105,yohL,"yohL orf, hypothetical protein ",5.7,6.1
B2106,yohM,"yohM orf, hypothetical protein ",6.1,5
B2107,B2107,"B2107 orf, hypothetical protein ",4.6,4.7
B2109,yehB,yehB putative outer membrane protein ,4.7,5.3
B2110,yehC,yehC putative chaperone ,,
B2112,yehE,"yehE orf, hypothetical protein ",3.5,6.8
B2113,mrp,mrp putative ATPase ,2.6,3.7
B2114,metG,metG methionine tRNA synthetase ,1.9,2.1
B2115,molR_1,"molR_1 molybdate metabolism regulator, first fragment ",,9.6
B2116,molR_2,"molR_2 molybdate metabolism regulator, second fragment 2 ",,9.3
B2117,molR_3,"molR_3 molybdate metabolism regulator, third fragment ",,12
B2118,yehI,yehI putative regulator ,4.4,8.9
B2119,yehL,"yehL orf, hypothetical protein ",4.5,8.3
B2120,yehM,"yehM orf, hypothetical protein ",,9.1
B2121,yehP,"yehP orf, hypothetical protein ",,5.8
B2122,yehQ,"yehQ orf, hypothetical protein ",5.2,6.3
B2123,yehR,"yehR orf, hypothetical protein ",,5.7
B2124,yehS,"yehS orf, hypothetical protein ",7.2,5.4
B2125,yehT,"yehT orf, hypothetical protein ",2.5,5.2
B2126,yehU,yehU putative 2-component sensor protein ,7.5,14.2
B2127,yehV,yehV putative transcriptional regulator ,,2.7
B2128,yehW,yehW putative transport system permease protein ,,3.5
B2129,yehX,yehX putative ATP-binding component of a transport system ,4.8,3
B2130,yehY,yehY putative transport system permease protein ,,
B2131,yehZ,yehZ putative transport system permease protein ,4.5,3.2
B2132,BglX,"BglX beta-D-glucoside glucohydrolase, periplasmic ",,6.7
B2133,dld,"dld D-lactate dehydrogenase, FAD protein, NADH independent ",4.5,3.6
B2134,pbpG,pbpG penicillin-binding protein 7 ,,3.1
B2135,yohC,"yohC orf, hypothetical protein ",5.6,5.6
B2136,yohD,"yohD orf, hypothetical protein ",6.7,4.2
B2137,yohF,yohF putative oxidoreductase ,,3
B2138,yohG,yohG putative channel/filament proteins ,,12.3
B2139,yohH,"yohH orf, hypothetical protein ",8,6.3
B2140,yohI,yohI putative regulator protein ,,5.9
B2141,yohJ,"yohJ orf, hypothetical protein ",,4.6
B2142,yohK,yohK putative seritonin transporter ,3.8,4.7
B2143,cdd,cdd cytidine/deoxycytidine deaminase ,3.8,6.2
B2144,sanA,sanA vancomycin sensitivity ,,8.2
B2145,B2145,"B2145 orf, hypothetical protein ",,5.8
B2146,B2146,B2146 putative oxidoreductase ,12.2,5.5
B2147,yeiA,yeiA putative oxidoreductase ,,6.5
B2148,mglC,mglC methyl-galactoside transport and galactose taxis ,4.8,11.7
B2149,mglA,mglA ATP-binding component of methyl-galactoside transport and galactose taxis ,,10.2
B2150,mglB,mglB galactose-binding transport protein; receptor for galactose taxis ,,10.4
B2151,galS,"galS mgl repressor, galactose operon inducer ",3.3,4.8
B2152,yeiB,"yeiB orf, hypothetical protein ",4.6,2.7
B2153,folE,folE GTP cyclohydrolase I ,,5.4
B2154,yeiG,yeiG putative esterase (EC 3.1.1.-). ,14.2,4.5
B2155,cirA,cirA outer membrane receptor for iron-regulated colicin I receptor; porin; requires tonB gene product ,,2.3
B2156,lysP,lysP lysine-specific permease ,3.8,3.6
B2157,yeiE,yeiE putative transcriptional regulator LYSR-type ,4.1,5.4
B2158,yeiH,"yeiH orf, hypothetical protein ",3.5,6.6
B2159,nfo,nfo endonuclease IV ,4.6,4.1
B2160,yeiI,yeiI putative kinase ,3.4,6.4
B2161,yeiJ,yeiJ putative transport system permease protein ,,
B2162,yeiK,"yeiK orf, hypothetical protein ",6.7,5.7
B2163,yeiL,yeiL putative transcriptional regulator ,6,8.7
B2164,yeiM,yeiM putative transport system permease protein ,4.6,6.8
B2165,yeiN,"yeiN orf, hypothetical protein ",5.3,7.2
B2166,yeiC,yeiC putative kinase ,,8.1
B2167,fruA,"fruA PTS system, fructose-specific transport protein ",5.5,5.3
B2168,fruK,fruK fructose-1-phosphate kinase ,5,3.5
B2169,fruB,"fruB PTS system, fructose-specific IIA/fpr component ",8.4,5.3
B2170,yeiO,yeiO putative transport ,,10.3
B2171,yeiP,yeiP putative elongation factor ,2.6,3.8
B2172,yeiQ,yeiQ putative oxidoreductase ,3.6,6.1
B2173,yeiR,"yeiR orf, hypothetical protein ",,6
B2174,B2174,"B2174 orf, hypothetical protein ",,5.5
B2175,spr,spr putative lipoprotein ,3.7,6.1
B2176,rtn,"rtn orf, hypothetical protein ",,6.9
B2177,yejA,"yejA orf, hypothetical protein ",5.5,5.8
B2178,yejB,yejB putative transport system permease protein ,,5.3
B2179,yejE,yejE putative transport system permease protein ,6.1,3.6
B2180,yejF,yejF putative ATP-binding component of a transport system ,,4.6
B2181,yejG,"yejG orf, hypothetical protein ",4.5,
B2182,Bcr,Bcr Bicyclomycin resistance protein; transmembrane protein ,3.7,
B2183,rsuA,rsuA 16S pseudouridylate 516 synthase ,4.5,5.8
B2184,yejH,yejH putative ATP-dependent helicase ,,8.1
B2185,rplY,rplY 50S ribosomal subunit protein L25 ,7.7,6.5
B2186,yejK,"yejK orf, hypothetical protein ",4.7,4.9
B2187,yejL,"yejL orf, hypothetical protein ",8.5,6.2
B2188,yejM,yejM putative sulfatase ,2.7,3.6
B2190,yejO,yejO putative ATP-binding component of a transport system ,,5
B2191,B2191,"B2191 orf, hypothetical protein ",,
B2192,trs5_8,trs5_8 IS5 transposase ,,8
B2193,narP,narP nitrate/nitrite response regulator (sensor NarQ) ,5.4,6
B2194,ccmH,ccmH possible subunit of heme lyase ,4.5,7.2
B2195,dsbE,dsbE disulfide oxidoreductase (in biogenesis of cytochrome c? ,5.5,7.2
B2196,ccmF,ccmF cytochrome c-type biogenesis protein ,6.3,5.9
B2197,ccmE,"ccmE cytochrome c biogenesis, possible subunit of a heme lyase ",,5.3
B2198,ccmD,ccmD heme exporter protein C ,,6.6
B2199,ccmC,ccmC heme exporter protein C ,7.6,5.4
B2200,ccmB,"ccmB heme exporter protein B, cytochrome c-type biogenesis protein ",9,8
B2201,ccmA,ccmA ATP binding protein of heme exporter A ,3.7,6.1
B2202,napC,napC cytochrome c-type protein ,5.3,8.9
B2203,napB,napB cytochrome c-type protein ,,5.2
B2204,napH,napH ferredoxin-type protein: electron transfer ,4.1,6.3
B2205,napG,napG ferredoxin-type protein: electron transfer ,3.6,6.3
B2206,napA,napA probable nitrate reductase 3 ,4.6,6.7
B2207,napD,"napD orf, hypothetical protein ",6.7,7.8
B2208,napF,napF ferredoxin-type protein: electron transfer ,5.4,6.5
B2209,eco,"eco ecotin, a serine protease inhibitor ",,8.1
B2210,yojH,"yojH orf, hypothetical protein ",2,2.7
B2211,yojI,yojI putative ATP-binding component of a transport system ,,3.8
B2212,alkB,alkB DNA repair system specific for alkylated DNA ,,4.9
B2213,ada,ada O6-methylguanine-DNA methyltransferase; transcription activator/repressor ,10.9,5.5
B2214,yojL,"yojL orf, hypothetical protein ",4.1,8.3
B2215,ompC,ompC outer membrane protein 1b (Ib;c) ,,9.7
B2216,yojN,yojN putative 2-component sensor protein ,2.6,3.5
B2217,rcsB,"rcsB positive response regulator for colanic capsule biosynthesis, (sensor, RcsC) ",3.8,3.1
B2218,rcsC,"rcsC sensor for ctr capsule biosynthesis, probable histidine kinase acting on RcsB ",4.3,4.9
B2219,atoS,atoS sensor protein AtoS for response regulator AtoC ,4.4,7.5
B2220,atoC,"atoC response regulator of ato, ornithine decarboxylase antizyme (sensor ATOS) ",4.1,4.3
B2221,atoD,atoD acetyl-CoA:acetoacetyl-CoA transferase alpha subunit ,,4.4
B2222,atoA,atoA acetyl-CoA:acetoacetyl-CoA transferase beta subunit ,8.6,5.9
B2223,atoE,atoE short chain fatty acid transporter ,,6.9
B2224,atoB,atoB acetyl-CoA acetyltransferase ,,5.3
B2225,B2225,"B2225 orf, hypothetical protein ",,5.8
B2226,B2226,"B2226 orf, hypothetical protein ",5.5,5.9
B2227,B2227,"B2227 orf, hypothetical protein ",,6.2
B2228,B2228,B2228 putative membrane protein ,,8.6
B2229,B2229,"B2229 orf, hypothetical protein ",5.2,5
B2230,yfaA,"yfaA orf, hypothetical protein ",,7.5
B2231,gyrA,"gyrA DNA gyrase, subunit A, type II topoisomerase ",3.8,2.6
B2232,ubiG,ubiG 3-demethylubiquinone-9 3-methyltransferase and 2-octaprenyl-6-hydroxy phenol methylase ,,3.7
B2233,yfaL,yfaL putative ATP-binding component of a transport system ,,4.7
B2234,nrdA,"nrdA ribonucleoside diphosphate reductase 1, alpha subunit, B1 ",1.6,2.4
B2235,nrdB,"nrdB ribonucleoside-diphosphate reductase 1, beta subunit, B2 ",1.4,2.9
B2236,yfaE,"yfaE orf, hypothetical protein ",2.8,3.5
B2237,inaA,inaA pH-inducible protein involved in stress response ,4.5,4.5
B2238,yfaH,"yfaH orf, hypothetical protein ",5,5.7
B2239,glpQ,"glpQ glycerophosphodiester phosphodiesterase, periplasmic ",,4.3
B2240,glpT,glpT sn-glycerol-3-phosphate permease ,,5.9
B2241,glpA,"glpA sn-glycerol-3-phosphate dehydrogenase (anaerobic), large subunit ",7.9,7.8
B2242,glpB,"glpB sn-glycerol-3-phosphate dehydrogenase (anaerobic), membrane anchor subunit ",,7.8
B2243,glpC,"glpC sn-glycerol-3-phosphate dehydrogenase (anaerobic), K-small subunit ",3.7,7.6
B2244,yfaD,"yfaD orf, hypothetical protein ",,
B2245,B2245,"B2245 orf, hypothetical protein ",,8.1
B2246,B2246,B2246 putative transport protein ,5.2,7
B2247,B2247,B2247 putative racemase ,,5.9
B2248,B2248,B2248 putative regulator ,3.6,7.4
B2249,B2249,"B2249 orf, hypothetical protein ",5.3,3.8
B2250,B2250,"B2250 orf, hypothetical protein ",7.7,5.8
B2251,yfaO,"yfaO orf, hypothetical protein ",,6
B2253,B2253,B2253 putative enzyme ,,5.7
B2254,B2254,B2254 putative sugar transferase ,,3.5
B2255,B2255,B2255 putative transformylase ,3.9,3.9
B2256,B2256,"B2256 orf, hypothetical protein ",,7.1
B2257,B2257,"B2257 orf, hypothetical protein ",,5
B2258,B2258,B2258 putative transport/receptor protein ,,5.7
B2259,pmrD,pmrD polymyxin resistance protein B ,,6.5
B2260,menE,menE o-succinylbenzoate-CoA ligase ,4.1,6
B2261,menC,menC o-succinylbenzoyl-CoA synthase; conversion of chorismate to 2-o-succinylbenzoyl-CoA ,,7
B2262,menB,menB dihydroxynaphtoic acid synthetase ,,12.2
B2263,yfbB,yfbB putative enzyme ,4.7,4
B2264,menD,menD 2-oxoglutarate decarboxylase; SHCHC synthase ,,3.1
B2265,menF,"menF isochorismate hydroxymutase 2, menaquinone biosynthesis ",5.9,4
B2266,elaB,"elaB orf, hypothetical protein ",,13.4
B2267,elaA,"elaA orf, hypothetical protein ",5.7,
B2268,elaC,"elaC orf, hypothetical protein ",,6.3
B2269,elaD,elaD putative sulfatase / phosphatase ,,6.3
B2270,yfbK,"yfbK orf, hypothetical protein ",,12.2
B2271,yfbL,yfbL putative aminopeptidase ,3.5,5.9
B2272,yfbM,"yfbM orf, hypothetical protein ",5,6.8
B2273,yfbN,"yfbN orf, hypothetical protein ",8.6,11.2
B2274,B2274,"B2274 orf, hypothetical protein ",,13.1
B2275,B2275,"B2275 orf, hypothetical protein ",,
B2276,nuoN,nuoN NADH dehydrogenase I chain N ,,16.6
B2277,nuoM,nuoM NADH dehydrogenase I chain M ,,10.3
B2278,nuoL,nuoL NADH dehydrogenase I chain L ,,17.9
B2279,nuoK,nuoK NADH dehydrogenase I chain K ,,
B2280,nuoJ,nuoJ NADH dehydrogenase I chain J ,,22.9
B2281,nuoI,nuoI NADH dehydrogenase I chain I ,,
B2282,nuoH,nuoH NADH dehydrogenase I chain H ,3.8,6.7
B2283,nuoG,nuoG NADH dehydrogenase I chain G ,2.8,4.2
B2284,nuoF,nuoF NADH dehydrogenase I chain F ,,4.2
B2285,nuoE,nuoE NADH dehydrogenase I chain E ,2.7,2.7
B2286,nuoC,"nuoC NADH dehydrogenase I chain C, D ",1.6,2.6
