Frame ID	Name	Unmodified Form	Location	Reaction ID	Reaction enzyme	Reaction	Mass balance?	EC	Comments
OX-GLUTAREDOXIN-C	reduced glutaredoxin 3	GRXC-MONOMER	"[""CCO-CYTOSOL""]"	"[""RX_WC_RXN-982""]"	"[[""EG12237-MONOMER""]]"	"[""[c]: arsenate + GRXC-MONOMER + h <==> aso3 + OX-GLUTAREDOXIN-C + h2o""]"	"[""Balanced.""]"	[null]	Manually removed recharging reaction.
KETOBUTFORMLY-MONOMER	2-ketobutyrate formate-lyase/pyruvate formate-lyase 4, inactive	KETOBUTFORMLY-INACT-MONOMER	"[""CCO-CYTOSOL""]"	"[""RX_WC_KETOBUTFORMLY-MONOMER1"", ""RX_WC_KETOBUTFORMLY-MONOMER2""]"	"[[""PFLACTENZ-MONOMER""],[""PFLACTENZ-MONOMER""]]"	"[""[c]: KETOBUTFORMLY-INACT-MONOMER + FLAVODOXIN1-MONOMER + amet ==> dad-2 + KETOBUTFORMLY-MONOMER + OX-FLAVODOXIN1"", ""[c]: KETOBUTFORMLY-INACT-MONOMER + FLAVODOXIN2-MONOMER + amet ==> dad-2 + KETOBUTFORMLY-MONOMER + OX-FLAVODOXIN2""]"	"[""Undetermined; a substrate lacks a chemical formula"", ""Undetermined; a substrate lacks a chemical formula""]"	[null, null]	Manually added RX_WC_KETOBUTFORMLY-MONOMER1 and RX_WC_KETOBUTFORMLY-MONOMER2. Replaced class species with instances.
AMINOMETHYLDIHYDROLIPOYL-GCVH	glycine cleavage system H protein	GCVH-MONOMER	"[""CCO-CYTOSOL""]"	"[""RX_WC_AMINOMETHYLDIHYDROLIPOYL-GCVH1""]"	"[[""GCVP-CPLX""]]"	"[""[c]: GCVH-MONOMER + gly ==> AMINOMETHYLDIHYDROLIPOYL-GCVH + co2""]"	"[""Balanced.""]"	[null]	Manually added RX_WC_AMINOMETHYLDIHYDROLIPOYL-GCVH1 reaction. Changed out class species and replaced with instance species.
GLUTAREDOXIN-MONOMER	reduced glutaredoxin 1	RED-GLUTAREDOXIN	"[""CCO-CYTOSOL""]"	"[""RX_WC_GLUTAREDOXIN-MONOMER""]"	"[[""EG12237-MONOMER""]]"	"[""[c]: arsenate + RED-GLUTAREDOXIN + h <==> aso3 + GLUTAREDOXIN-MONOMER + h2o""]"	"[""Balanced.""]"	[null]	Manually added reaction for arsenate degradation.
OX-GLUTAREDOXIN-B	reduced glutaredoxin 2	GRXB-MONOMER	"[""CCO-CYTOSOL""]"	"[""RX_WC_OX-GLUTAREDOXIN-B""]"	"[[""EG12237-MONOMER""]]"	"[""[c]: arsenate + GRXB-MONOMER + h <==> aso3 + OX-GLUTAREDOXIN-B + h2o""]"	"[""Balanced.""]"	[null]	Manually added reaction for arsenate degradation.
